{
  "schema_version": 1,
  "map_id": "a1_candidate_unit_map_cur_005",
  "status": "candidate_not_final",
  "reviewed_at": "2026-07-16T04:54:11+03:00",
  "evidence_dataset_ids": [
    "gse_a1_objectives",
    "cefr_a1_descriptors"
  ],
  "prior_proposal_test": {
    "proposed_units": [
      "Identity",
      "People & Relationships",
      "Everyday Life",
      "Places & Movement",
      "Needs & Transactions",
      "Simple Communication",
      "Reading, Signs & Forms"
    ],
    "verdict": "not_supported_as_an_exact_final_map",
    "fit_counts": {
      "forced": 67,
      "natural": 91,
      "not_applicable": 1,
      "overlap": 60
    },
    "objective_fit_counts": {
      "forced": 27,
      "natural": 58,
      "not_applicable": 1,
      "overlap": 35
    },
    "descriptor_fit_counts": {
      "forced": 40,
      "natural": 33,
      "overlap": 25
    },
    "findings": [
      "Home, objects, and descriptions overlaps earlier topic boundaries.",
      "Reading, Signs & Forms mixes a channel with several communicative purposes.",
      "Simple Communication absorbs distinct social, repair, mediation, and language-control evidence.",
      "Cross-cutting support should not be forced into standalone topical units."
    ]
  },
  "coverage": {
    "record_count": 219,
    "included_count": 218,
    "excluded_count": 1,
    "mapping_fit_counts": {
      "cross_cutting": 46,
      "explicit_exclusion": 1,
      "natural": 151,
      "natural_with_support": 21
    }
  },
  "clusters": [
    {
      "cluster_id": "identity_personal_information",
      "title": "Identity and personal information",
      "role": "candidate_unit",
      "goal": "Exchange and record basic personal information.",
      "prior_unit": "Identity",
      "prior_fit": "natural",
      "assignment_count": 24,
      "objective_count": 14,
      "descriptor_count": 10,
      "record_ids": [
        "gse.adult.2022.p09.009",
        "gse.adult.2022.p14.001",
        "gse.adult.2022.p14.005",
        "gse.adult.2022.p15.011",
        "gse.adult.2022.p15.014",
        "gse.adult.2022.p22.006",
        "gse.adult.2022.p22.009",
        "gse.adult.2022.p22.023",
        "gse.adult.2022.p22.027",
        "gse.adult.2022.p23.004",
        "gse.adult.2022.p23.008",
        "gse.adult.2022.p37.001",
        "gse.adult.2022.p37.004",
        "gse.adult.2022.p37.010",
        "cefr.cv2020.p063.sustained_monologue_describing_experience.01",
        "cefr.cv2020.p067.creative_writing.01",
        "cefr.cv2020.p079.information_exchange.03",
        "cefr.cv2020.p080.interviewing_and_being_interviewed.01",
        "cefr.cv2020.p082.overall_written_interaction.01",
        "cefr.cv2020.p084.notes_messages_and_forms.01",
        "cefr.cv2020.p116.acting_as_an_intermediary_in_informal_situations.01",
        "cefr.cv2020.p131.general_linguistic_range.01",
        "cefr.cv2020.p136.orthographic_control.02",
        "cefr.cv2020.p142.propositional_precision.01"
      ]
    },
    {
      "cluster_id": "people_relationships",
      "title": "People and relationships",
      "role": "candidate_unit",
      "goal": "Talk about family, friends, known people, jobs, and possessions.",
      "prior_unit": "People & Relationships",
      "prior_fit": "natural",
      "assignment_count": 21,
      "objective_count": 14,
      "descriptor_count": 7,
      "record_ids": [
        "gse.adult.2022.p14.007",
        "gse.adult.2022.p22.001",
        "gse.adult.2022.p22.002",
        "gse.adult.2022.p22.006",
        "gse.adult.2022.p22.022",
        "gse.adult.2022.p23.004",
        "gse.adult.2022.p23.005",
        "gse.adult.2022.p23.013",
        "gse.adult.2022.p24.004",
        "gse.adult.2022.p24.007",
        "gse.adult.2022.p37.005",
        "gse.adult.2022.p37.010",
        "gse.adult.2022.p37.014",
        "gse.adult.2022.p37.016",
        "cefr.cv2020.p049.understanding_conversation_between_other_people.01",
        "cefr.cv2020.p062.overall_oral_production.01",
        "cefr.cv2020.p066.overall_written_production.01",
        "cefr.cv2020.p074.conversation.02",
        "cefr.cv2020.p079.information_exchange.03",
        "cefr.cv2020.p083.correspondence.03",
        "cefr.cv2020.p116.acting_as_an_intermediary_in_informal_situations.01"
      ]
    },
    {
      "cluster_id": "routines_time_leisure",
      "title": "Routines, time, and leisure",
      "role": "candidate_unit",
      "goal": "Understand and express routines, schedules, interests, abilities, and weather.",
      "prior_unit": "Everyday Life",
      "prior_fit": "natural",
      "assignment_count": 38,
      "objective_count": 26,
      "descriptor_count": 12,
      "record_ids": [
        "gse.adult.2022.p09.010",
        "gse.adult.2022.p09.012",
        "gse.adult.2022.p14.003",
        "gse.adult.2022.p14.004",
        "gse.adult.2022.p14.009",
        "gse.adult.2022.p14.014",
        "gse.adult.2022.p14.015",
        "gse.adult.2022.p15.003",
        "gse.adult.2022.p15.005",
        "gse.adult.2022.p15.008",
        "gse.adult.2022.p15.009",
        "gse.adult.2022.p15.010",
        "gse.adult.2022.p15.018",
        "gse.adult.2022.p22.003",
        "gse.adult.2022.p22.014",
        "gse.adult.2022.p22.016",
        "gse.adult.2022.p22.019",
        "gse.adult.2022.p22.023",
        "gse.adult.2022.p23.006",
        "gse.adult.2022.p23.015",
        "gse.adult.2022.p23.016",
        "gse.adult.2022.p23.018",
        "gse.adult.2022.p37.008",
        "gse.adult.2022.p37.012",
        "gse.adult.2022.p37.015",
        "gse.adult.2022.p37.018",
        "cefr.cv2020.p048.overall_oral_comprehension.02",
        "cefr.cv2020.p049.understanding_conversation_between_other_people.01",
        "cefr.cv2020.p055.reading_correspondence.02",
        "cefr.cv2020.p059.reading_as_a_leisure_activity.01",
        "cefr.cv2020.p063.sustained_monologue_describing_experience.02",
        "cefr.cv2020.p066.overall_written_production.01",
        "cefr.cv2020.p075.informal_discussion_with_friends.01",
        "cefr.cv2020.p077.goal_oriented_co_operation.02",
        "cefr.cv2020.p079.information_exchange.04",
        "cefr.cv2020.p083.correspondence.01",
        "cefr.cv2020.p086.online_conversation_and_discussion.01",
        "cefr.cv2020.p095.relaying_specific_information_in_speech_or_sign.01"
      ]
    },
    {
      "cluster_id": "home_objects_descriptions",
      "title": "Home, objects, and descriptions",
      "role": "candidate_unit",
      "goal": "Locate and describe familiar homes, objects, pictures, and surroundings.",
      "prior_unit": null,
      "prior_fit": "overlap",
      "assignment_count": 29,
      "objective_count": 20,
      "descriptor_count": 9,
      "record_ids": [
        "gse.adult.2022.p09.002",
        "gse.adult.2022.p09.003",
        "gse.adult.2022.p14.008",
        "gse.adult.2022.p14.011",
        "gse.adult.2022.p15.013",
        "gse.adult.2022.p22.004",
        "gse.adult.2022.p22.006",
        "gse.adult.2022.p22.008",
        "gse.adult.2022.p22.015",
        "gse.adult.2022.p22.017",
        "gse.adult.2022.p22.026",
        "gse.adult.2022.p22.027",
        "gse.adult.2022.p23.003",
        "gse.adult.2022.p23.004",
        "gse.adult.2022.p23.008",
        "gse.adult.2022.p24.001",
        "gse.adult.2022.p37.007",
        "gse.adult.2022.p37.010",
        "gse.adult.2022.p37.017",
        "gse.adult.2022.p37.019",
        "cefr.cv2020.p049.understanding_conversation_between_other_people.01",
        "cefr.cv2020.p063.sustained_monologue_describing_experience.01",
        "cefr.cv2020.p063.sustained_monologue_giving_information.01",
        "cefr.cv2020.p067.creative_writing.01",
        "cefr.cv2020.p067.creative_writing.02",
        "cefr.cv2020.p067.creative_writing.03",
        "cefr.cv2020.p079.information_exchange.03",
        "cefr.cv2020.p079.information_exchange.06",
        "cefr.cv2020.p136.orthographic_control.01"
      ]
    },
    {
      "cluster_id": "places_directions_travel",
      "title": "Places, directions, and travel",
      "role": "candidate_unit",
      "goal": "Understand and manage basic locations, routes, transport, and travel details.",
      "prior_unit": "Places & Movement",
      "prior_fit": "natural",
      "assignment_count": 31,
      "objective_count": 14,
      "descriptor_count": 17,
      "record_ids": [
        "gse.adult.2022.p09.004",
        "gse.adult.2022.p09.006",
        "gse.adult.2022.p09.010",
        "gse.adult.2022.p14.007",
        "gse.adult.2022.p15.004",
        "gse.adult.2022.p15.015",
        "gse.adult.2022.p15.017",
        "gse.adult.2022.p22.001",
        "gse.adult.2022.p22.011",
        "gse.adult.2022.p22.025",
        "gse.adult.2022.p23.009",
        "gse.adult.2022.p24.005",
        "gse.adult.2022.p37.002",
        "gse.adult.2022.p37.011",
        "cefr.cv2020.p048.overall_oral_comprehension.02",
        "cefr.cv2020.p051.understanding_as_a_member_of_a_live.01",
        "cefr.cv2020.p051.understanding_announcements_and_instructions.01",
        "cefr.cv2020.p051.understanding_announcements_and_instructions.02",
        "cefr.cv2020.p051.understanding_announcements_and_instructions.03",
        "cefr.cv2020.p052.understanding_audio_or_signed_media_and_recordings.01",
        "cefr.cv2020.p055.reading_correspondence.02",
        "cefr.cv2020.p056.reading_for_orientation.02",
        "cefr.cv2020.p056.reading_for_orientation.03",
        "cefr.cv2020.p057.reading_for_information_and_argument.02",
        "cefr.cv2020.p058.reading_instructions.01",
        "cefr.cv2020.p073.understanding_an_interlocutor.02",
        "cefr.cv2020.p077.goal_oriented_co_operation.01",
        "cefr.cv2020.p077.goal_oriented_co_operation.02",
        "cefr.cv2020.p079.information_exchange.01",
        "cefr.cv2020.p084.notes_messages_and_forms.01",
        "cefr.cv2020.p095.relaying_specific_information_in_speech_or_sign.01"
      ]
    },
    {
      "cluster_id": "food_shopping_services",